{
  "$schema": "https://json-schema.org/draft/2020-12/schema",
  "$id": "https://religion-knowledge.local/timeline/tradition.schema.json",
  "title": "Tradition",
  "description": "Reference schema for docs/timeline/SPEC.md §7.1's Tradition node type — a religious/cosmological system modeled as a time-varying entity (implements P3: never a rung on a linear-progression ladder). Requires a TraditionDating object (§5.2, implements P8: oral traditions get the five/six-date treatment, never one fake-precise date) and non-hierarchical category_tags. Entities aggregate claims; they assert nothing on their own — every substantive statement about a Tradition lives in a linked Claim (subject_type: Tradition, subject_id: this entity's id), not inline here. The hand-rolled validator (docs/timeline/scripts/validate-timeline.mjs) is authoritative if this file and the validator diverge.",
  "type": "object",
  "required": ["id", "name", "category_tags", "region", "dating"],
  "properties": {
    "id": {
      "type": "string",
      "pattern": "^trad_[a-z0-9_-]+$"
    },
    "name": {
      "type": "string",
      "description": "Common name, e.g. 'Ifá/Òrìṣà tradition (Yoruba)', 'San /Xam cosmology'."
    },
    "category_tags": {
      "type": "array",
      "minItems": 1,
      "description": "SPEC.md §7.1 / P3: tags, never rungs on a ladder. A tradition may carry more than one tag (e.g. a tradition with both ancestor veneration and a high god carries both tags, not a forced single label).",
      "items": {
        "type": "string",
        "enum": ["animism", "ancestor_veneration", "polytheism", "henotheism", "monolatry", "monotheism", "pantheism", "panentheism", "non_theistic", "mixed"]
      }
    },
    "region": {
      "type": "array",
      "items": { "type": "string" },
      "minItems": 1
    },
    "dating": {
      "type": "object",
      "description": "TraditionDating object, SPEC.md §5.2. Any of the six dated fields may be null; dating_summary is mandatory.",
      "required": ["dating_summary"],
      "properties": {
        "earliest_archaeological_evidence": { "$ref": "#/$defs/dating_entry" },
        "earliest_written_attestation": { "$ref": "#/$defs/dating_entry" },
        "surviving_manuscript_date": { "$ref": "#/$defs/dating_entry" },
        "estimated_composition": {
          "type": ["object", "null"],
          "properties": {
            "range": { "$ref": "#/$defs/range" },
            "method": { "type": ["string", "null"] },
            "disputed": { "type": ["boolean", "null"] }
          }
        },
        "tradition_internal_claim": { "$ref": "#/$defs/dating_entry" },
        "estimated_oral_origin": {
          "type": ["object", "null"],
          "properties": {
            "range": { "$ref": "#/$defs/range" },
            "method": { "type": ["string", "null"] },
            "confidence": { "type": ["string", "null"], "enum": ["HIGH", "MODERATE", "LOW", "DISPUTED", "UNKNOWN", null] }
          }
        },
        "dating_summary": {
          "type": "string",
          "minLength": 1,
          "description": "One honest sentence, e.g. 'Earliest securely documented practice c. X; earlier origins probable; how much earlier unknown.'"
        }
      }
    },
    "relationships": {
      "type": "array",
      "description": "SPEC.md §7.2 edge types. An influence edge without a source that asserts the influence is invalid — motif similarity alone cannot create an edge.",
      "items": {
        "type": "object",
        "required": ["edge_type", "target_id", "confidence", "claim_id"],
        "properties": {
          "edge_type": {
            "type": "string",
            "enum": ["DESCENT", "REFORM", "SCHISM", "SYNCRETISM", "BORROWING", "CONQUEST", "MISSIONIZATION", "TRANSLATION", "STATE_ADOPTION", "SUPPRESSION", "REVIVAL", "CULTURAL_FUSION", "DEITY_IDENTIFICATION", "DEITY_RENAMING", "SHARED_ANCESTRY", "GENE_FLOW", "PATRONAGE", "UNCERTAIN_CONNECTION"]
          },
          "target_id": { "type": "string", "description": "Id of the entity (Tradition, Polity, etc.) at the other end of this edge." },
          "confidence": { "type": "string", "enum": ["HIGH", "MODERATE", "LOW", "DISPUTED", "UNKNOWN"] },
          "claim_id": { "type": "string", "description": "The Claim that sources this edge." }
        }
      }
    },
    "notes": { "type": ["string", "null"] }
  },
  "$defs": {
    "range": {
      "type": ["object", "null"],
      "required": ["earliest", "latest", "precision"],
      "properties": {
        "earliest": { "type": ["integer", "null"] },
        "latest": { "type": ["integer", "null"] },
        "precision": { "type": "string", "enum": ["YEAR", "DECADE", "CENTURY", "MILLENNIUM", "ORDER_OF_MAGNITUDE"] }
      }
    },
    "dating_entry": {
      "type": ["object", "null"],
      "properties": {
        "range": { "$ref": "#/$defs/range" },
        "note": { "type": ["string", "null"] }
      }
    }
  }
}
